{
  "campaign_id": "camp_demo_001",
  "allowed": [
    {"claim_id": "c1", "text": "FEATURE_NAME lets teams schedule posts"},
    {"claim_id": "c2", "text": "FEATURE_NAME helps teams do PLACEHOLDER_BENEFIT"}
  ],
  "forbidden": [
    {
      "claim_id": "f1",
      "text": "unlimited seats for $0",
      "reason": "pricing invention — fixture forbidden list seed"
    }
  ],
  "needs_disclaimer": [],
  "evidence": [
    {
      "claim_id": "c1",
      "source": "github_outline",
      "path": "sources/github_outline.md",
      "span_start": 0,
      "span_end": 80,
      "quote": "FEATURE_NAME lets teams schedule posts"
    },
    {
      "claim_id": "c2",
      "source": "loom_transcript",
      "path": "sources/loom_transcript.txt",
      "span_start": 0,
      "span_end": 120,
      "quote": "FEATURE_NAME helps teams do PLACEHOLDER_BENEFIT"
    }
  ],
  "kill_switch": { "armed": false, "reason": null }
}
